{
  "$schema": "https://json-schema.org/draft/2020-12/schema",
  "$id": "https://raw.githubusercontent.com/carrot-foundation/schemas/refs/heads/main/schemas/ipfs/shared/references/gas-id-reference/gas-id-reference.schema.json",
  "title": "GasID Reference",
  "description": "Reference to a GasID record.",
  "type": "object",
  "required": ["external_id", "token_id", "external_url", "uri"],
  "properties": {
    "external_id": {
      "$ref": "../../definitions/definitions.schema.json#/$defs/external_id",
      "description": "Unique identifier for the GasID."
    },
    "token_id": {
      "$ref": "../../definitions/definitions.schema.json#/$defs/token_id",
      "description": "NFT token ID of the GasID."
    },
    "external_url": {
      "$ref": "../../definitions/definitions.schema.json#/$defs/external_url",
      "description": "URL to view the GasID on Carrot Explorer."
    },
    "uri": {
      "$ref": "../../definitions/definitions.schema.json#/$defs/ipfs_uri",
      "description": "IPFS URI of the GasID record."
    }
  },
  "additionalProperties": false
}
